{
  "schema_ref": "design/system_v3/07_Responsive_System/Page_Conformance_Profile_Schema_V1.json",
  "schema_version": "1.0",
  "profile_id": "auth-login-responsive-profile-candidate-v1",
  "page_id": "auth_login_v2",
  "status": "DRAFT",
  "authority_bindings": [
    {
      "authority_ref_id": "responsive-standard",
      "locator": "heading:responsive policy",
      "resolution_mode": "REFERENCE_ONLY"
    },
    {
      "authority_ref_id": "login-behavior",
      "locator": "heading:login interaction",
      "resolution_mode": "REFERENCE_ONLY"
    },
    {
      "authority_ref_id": "login-visual-spec",
      "locator": "heading:V2.1 frozen visual",
      "resolution_mode": "REFERENCE_ONLY"
    },
    {
      "authority_ref_id": "login-visual-authority",
      "locator": "registered visual authority bytes",
      "resolution_mode": "REFERENCE_ONLY"
    },
    {
      "authority_ref_id": "login-responsive-matrix",
      "locator": "machine-readable responsive acceptance matrix",
      "resolution_mode": "REFERENCE_ONLY"
    }
  ],
  "numeric_authority": {
    "status": "BOUND_SINGLE",
    "authority_ref_id": "login-responsive-matrix"
  },
  "conformance": {
    "regions": [
      {
        "region_id": "login-form-layout",
        "component_ids": [
          "credential-form",
          "primary-submit-action"
        ],
        "authority_bindings": [
          {
            "authority_ref_id": "login-behavior",
            "locator": "heading:login form",
            "resolution_mode": "REFERENCE_ONLY"
          },
          {
            "authority_ref_id": "login-visual-spec",
            "locator": "heading:form area",
            "resolution_mode": "REFERENCE_ONLY"
          }
        ]
      }
    ],
    "component_relationships": [
      {
        "relationship_id": "login-form-contains-submit",
        "parent_component_id": "credential-form",
        "child_component_id": "primary-submit-action",
        "relationship": "CONTAINS",
        "authority_bindings": [
          {
            "authority_ref_id": "login-behavior",
            "locator": "heading:login form",
            "resolution_mode": "REFERENCE_ONLY"
          }
        ]
      }
    ],
    "responsive_rules": [
      {
        "item_id": "login-draft-responsive-reference",
        "authority_bindings": [
          {
            "authority_ref_id": "login-visual-spec",
            "locator": "heading:layout and geometry",
            "resolution_mode": "REFERENCE_ONLY"
          },
          {
            "authority_ref_id": "responsive-standard",
            "locator": "heading:responsive policy",
            "resolution_mode": "REFERENCE_ONLY"
          },
          {
            "authority_ref_id": "login-responsive-matrix",
            "locator": "machine-readable responsive acceptance matrix",
            "resolution_mode": "REFERENCE_ONLY"
          }
        ]
      }
    ],
    "content_priorities": [
      {
        "item_id": "login-field-priority",
        "authority_bindings": [
          {
            "authority_ref_id": "login-behavior",
            "locator": "heading:login interaction",
            "resolution_mode": "REFERENCE_ONLY"
          }
        ]
      }
    ],
    "page_states": [
      {
        "item_id": "login-form-states",
        "authority_bindings": [
          {
            "authority_ref_id": "login-behavior",
            "locator": "heading:loading and validation states",
            "resolution_mode": "REFERENCE_ONLY"
          }
        ]
      }
    ],
    "overflow_scroll_policies": [
      {
        "item_id": "login-content-overflow",
        "authority_bindings": [
          {
            "authority_ref_id": "login-visual-spec",
            "locator": "heading:form area",
            "resolution_mode": "REFERENCE_ONLY"
          }
        ]
      }
    ],
    "visual_anchors": [
      {
        "item_id": "login-frozen-visual-binding",
        "authority_bindings": [
          {
            "authority_ref_id": "login-visual-spec",
            "locator": "heading:V2.1 frozen visual",
            "resolution_mode": "REFERENCE_ONLY"
          },
          {
            "authority_ref_id": "login-visual-authority",
            "locator": "registered visual authority bytes",
            "resolution_mode": "REFERENCE_ONLY"
          }
        ]
      }
    ],
    "validation_conditions": [
      {
        "item_id": "login-draft-conditions",
        "authority_bindings": [
          {
            "authority_ref_id": "login-behavior",
            "locator": "heading:login validation",
            "resolution_mode": "REFERENCE_ONLY"
          },
          {
            "authority_ref_id": "login-visual-spec",
            "locator": "heading:V2.1 frozen visual",
            "resolution_mode": "REFERENCE_ONLY"
          },
          {
            "authority_ref_id": "login-responsive-matrix",
            "locator": "machine-readable responsive acceptance matrix",
            "resolution_mode": "REFERENCE_ONLY"
          }
        ]
      }
    ]
  }
}
