{
  "schema_ref": "design/system_v3/07_Responsive_System/Page_Conformance_Profile_Schema_V1.json",
  "schema_version": "1.0",
  "profile_id": "home-empty-responsive-profile-draft-v1",
  "page_id": "home_empty_v2",
  "status": "DRAFT",
  "authority_bindings": [
    {
      "authority_ref_id": "responsive-standard",
      "locator": "heading:responsive policy",
      "resolution_mode": "REFERENCE_ONLY"
    },
    {
      "authority_ref_id": "empty-home-behavior",
      "locator": "heading:page behavior",
      "resolution_mode": "REFERENCE_ONLY"
    },
    {
      "authority_ref_id": "empty-home-visual-spec",
      "locator": "heading:V2.2 approved delta",
      "resolution_mode": "REFERENCE_ONLY"
    },
    {
      "authority_ref_id": "empty-responsive-mapping",
      "locator": "/groups",
      "resolution_mode": "REFERENCE_ONLY"
    },
    {
      "authority_ref_id": "empty-home-visual",
      "locator": "registered visual authority bytes",
      "resolution_mode": "REFERENCE_ONLY"
    }
  ],
  "numeric_authority": {
    "status": "BOUND_SINGLE",
    "authority_ref_id": "empty-responsive-mapping"
  },
  "conformance": {
    "regions": [
      {
        "region_id": "empty-home-scene",
        "component_ids": [
          "empty-scene",
          "empty-prompt",
          "capture-actions"
        ],
        "authority_bindings": [
          {
            "authority_ref_id": "empty-responsive-mapping",
            "locator": "/groups",
            "resolution_mode": "REFERENCE_ONLY"
          },
          {
            "authority_ref_id": "empty-home-behavior",
            "locator": "heading:empty state",
            "resolution_mode": "REFERENCE_ONLY"
          }
        ]
      }
    ],
    "component_relationships": [
      {
        "relationship_id": "empty-home-scene-contains-prompt",
        "parent_component_id": "empty-scene",
        "child_component_id": "empty-prompt",
        "relationship": "CONTAINS",
        "authority_bindings": [
          {
            "authority_ref_id": "empty-responsive-mapping",
            "locator": "/groups",
            "resolution_mode": "REFERENCE_ONLY"
          }
        ]
      }
    ],
    "responsive_rules": [
      {
        "item_id": "empty-home-page-rules",
        "authority_bindings": [
          {
            "authority_ref_id": "empty-responsive-mapping",
            "locator": "/width_profiles_dp",
            "resolution_mode": "REFERENCE_ONLY"
          },
          {
            "authority_ref_id": "empty-responsive-mapping",
            "locator": "/height_profiles_safe_viewport_dp",
            "resolution_mode": "REFERENCE_ONLY"
          }
        ]
      }
    ],
    "content_priorities": [
      {
        "item_id": "empty-home-content-priority",
        "authority_bindings": [
          {
            "authority_ref_id": "empty-home-behavior",
            "locator": "heading:page behavior",
            "resolution_mode": "REFERENCE_ONLY"
          }
        ]
      }
    ],
    "page_states": [
      {
        "item_id": "empty-home-state",
        "authority_bindings": [
          {
            "authority_ref_id": "empty-home-behavior",
            "locator": "heading:empty state",
            "resolution_mode": "REFERENCE_ONLY"
          }
        ]
      }
    ],
    "overflow_scroll_policies": [
      {
        "item_id": "empty-home-scene-overflow",
        "authority_bindings": [
          {
            "authority_ref_id": "empty-responsive-mapping",
            "locator": "/groups/scene_space",
            "resolution_mode": "REFERENCE_ONLY"
          }
        ]
      }
    ],
    "visual_anchors": [
      {
        "item_id": "empty-home-visual-authority",
        "authority_bindings": [
          {
            "authority_ref_id": "empty-home-visual-spec",
            "locator": "heading:approved visual delta",
            "resolution_mode": "REFERENCE_ONLY"
          },
          {
            "authority_ref_id": "empty-home-visual",
            "locator": "registered visual authority bytes",
            "resolution_mode": "REFERENCE_ONLY"
          }
        ]
      }
    ],
    "validation_conditions": [
      {
        "item_id": "empty-home-draft-validation",
        "authority_bindings": [
          {
            "authority_ref_id": "empty-responsive-mapping",
            "locator": "/safe_drawing_insets",
            "resolution_mode": "REFERENCE_ONLY"
          },
          {
            "authority_ref_id": "responsive-standard",
            "locator": "heading:safe area",
            "resolution_mode": "REFERENCE_ONLY"
          }
        ]
      }
    ]
  }
}
