{
  "schema_ref": "design/system_v3/07_Responsive_System/Page_Conformance_Profile_Schema_V1.json",
  "schema_version": "1.0",
  "profile_id": "home-normal-responsive-profile-v1",
  "page_id": "home_normal_v1",
  "status": "FROZEN_BINDING",
  "authority_bindings": [
    {
      "authority_ref_id": "responsive-standard",
      "locator": "heading:global coordinate and inset semantics",
      "resolution_mode": "REFERENCE_ONLY"
    },
    {
      "authority_ref_id": "nh01-responsive-v2",
      "locator": "/responsive_model",
      "resolution_mode": "REFERENCE_ONLY"
    },
    {
      "authority_ref_id": "normal-home-visual",
      "locator": "registered visual authority bytes",
      "resolution_mode": "REFERENCE_ONLY"
    }
  ],
  "numeric_authority": {
    "status": "BOUND_SINGLE",
    "authority_ref_id": "nh01-responsive-v2"
  },
  "conformance": {
    "regions": [
      {
        "region_id": "normal-home-composition",
        "component_ids": [
          "normal-home-header",
          "normal-home-content",
          "normal-home-footer"
        ],
        "authority_bindings": [
          {
            "authority_ref_id": "nh01-responsive-v2",
            "locator": "/layout_regions",
            "resolution_mode": "REFERENCE_ONLY"
          }
        ]
      }
    ],
    "component_relationships": [
      {
        "relationship_id": "normal-home-composition-contains-header",
        "parent_component_id": "normal-home-composition",
        "child_component_id": "normal-home-header",
        "relationship": "CONTAINS",
        "authority_bindings": [
          {
            "authority_ref_id": "nh01-responsive-v2",
            "locator": "/components",
            "resolution_mode": "REFERENCE_ONLY"
          }
        ]
      }
    ],
    "responsive_rules": [
      {
        "item_id": "normal-home-responsive-policy",
        "authority_bindings": [
          {
            "authority_ref_id": "nh01-responsive-v2",
            "locator": "/responsive_model",
            "resolution_mode": "REFERENCE_ONLY"
          },
          {
            "authority_ref_id": "responsive-standard",
            "locator": "heading:responsive policy",
            "resolution_mode": "REFERENCE_ONLY"
          }
        ]
      }
    ],
    "content_priorities": [
      {
        "item_id": "normal-home-content-priority",
        "authority_bindings": [
          {
            "authority_ref_id": "nh01-responsive-v2",
            "locator": "/conflict_resolution",
            "resolution_mode": "REFERENCE_ONLY"
          }
        ]
      }
    ],
    "page_states": [
      {
        "item_id": "normal-home-record-states",
        "authority_bindings": [
          {
            "authority_ref_id": "nh01-responsive-v2",
            "locator": "/components",
            "resolution_mode": "REFERENCE_ONLY"
          }
        ]
      }
    ],
    "overflow_scroll_policies": [
      {
        "item_id": "normal-home-overflow-policy",
        "authority_bindings": [
          {
            "authority_ref_id": "nh01-responsive-v2",
            "locator": "/overflow_policy",
            "resolution_mode": "REFERENCE_ONLY"
          }
        ]
      }
    ],
    "visual_anchors": [
      {
        "item_id": "normal-home-frozen-anchors",
        "authority_bindings": [
          {
            "authority_ref_id": "nh01-responsive-v2",
            "locator": "/visual_anchors",
            "resolution_mode": "REFERENCE_ONLY"
          },
          {
            "authority_ref_id": "normal-home-visual",
            "locator": "registered visual authority bytes",
            "resolution_mode": "REFERENCE_ONLY"
          }
        ]
      }
    ],
    "validation_conditions": [
      {
        "item_id": "normal-home-contract-conditions",
        "authority_bindings": [
          {
            "authority_ref_id": "nh01-responsive-v2",
            "locator": "/acceptance",
            "resolution_mode": "REFERENCE_ONLY"
          },
          {
            "authority_ref_id": "nh01-responsive-v2",
            "locator": "/profiles",
            "resolution_mode": "REFERENCE_ONLY"
          }
        ]
      }
    ]
  }
}
